URL,Page Titles,Meta Descriptions,Meta Keywords,H1 Titles,H2 Titles
http://cafecitacoffee.com,Cafecita is a women-owned coffee roaster based in Los Angeles. – Cafecita CoffeeAmerican ExpressApple PayDiners ClubDiscoverMeta PayGoogle PayMastercardShop PayVisaAmerican ExpressApple PayDiners ClubDiscoverMeta PayGoogle PayMastercardShop PayVisa,Cafecita is a women-owned coffee roaster based in Los Angeles. All our coffees come from sustainable women-owned coffee farms and co-ops, and a percentage of every sale goes to supporting women’s nonprofits around the world. All our coffees are single origin and freshly roasted in small batches each week.,,<div class="image image--30193812308190 regular-logo"> <img class="image__img" src="//cafecitacoffee.com/cdn/shop/files/black_with_white_2048x2048_crop_center.jpg?v=1657390576" alt="Cafecita Coffee Logo"> </div> Cafecita Coffee,Currency
http://victuscoffee.com,Victus Coffee | Great Coffee Fuels Great Causes | West Hartford CT American ExpressApple PayDiners ClubDiscoverMeta PayGoogle PayMastercardPayPalShop PayVenmoVisa,Great Coffee Fuels Great Causes. We pledge a portion of proceeds from each bag sold to great causes, both locally & globally! Buy 2 or more bags and enjoy FREE SHIPPING.,,Victus Coffee,VICTUS COFFEE, GREAT COFFEE FUELS GREAT CAUSES, Drink Great Coffee in West Hartford Center, Each of us has a purpose., The Fuel Your Purpose Series, Sign Up & Stay Connected
http://darkmattercoffee.com,Get Freshly Roasted! | Dark Matter CoffeeSearchSearchCartSearchRightDownCartSearchToggle menuToggle menuToggle menuTwitterFacebookYoutubeInstagramPinterestDownLeftRightTwitterFacebookYoutubeInstagramPinterestRightAmerican ExpressApple PayDiners ClubDiscoverMeta PayGoogle PayJCBMastercardPayPalShop PayVenmoVisa,Dark Matter Coffee roasts the highest quality coffee beans daily, supporting sustainability. Purchase a coffee subscription or visit one of our eight locations throughout the Chicago area.,,,Our Collections, Coffee, About, Featured Content
http://sevencoffeeroasters.com,Seattle Coffee Company | Seattle Coffee Roasters | Seven CoffeeAmazonAmerican ExpressApple PayDiners ClubDiscoverMeta PayGoogle PayJCBMastercardPayPalShop PayVenmoVisa,Seven Coffee Roasters is a small-batch and hand roasted purveyor of artisan coffee. Browse our website for the best coffee for sale in Seattle!,,Born in Hawaii. Made in Seattle., Keala's Hawaiian Coffee,OUR BEST SELLERS, LOOK THROUGH OUR CATEGORIES, Hawaiian Coffee, Signature Blends, Single Origin, LEARN MORE ABOUT YOUR BREW
http://wccbdc.org,Home | 2022 Kitchen812,,,Kitchen@812,Pinole, CA, where food meets business, dreamers are welcome, "Kitchen@812 not only provided a space to get started, but is providing the support we need to be successful.", cooking up success, at Bay Area farmers markets, community festivals and food retail outlets, our Kitchen@812 entrepreneurs are working to build their food businesses, ready to get started?, we'd love to hear from you!
http://contracostasbdc.com,East Bay SBDC - Northern California Regionstar,Last year SBDC helped more than 16,000 businesses based in Northern California realize $645 Million dollars in capital investment, and create over 10,000…,,Business,Better.,—, East Bay SBDC Programs, Upcoming Events, Real Businesses,Real Results, News & Updates
http://eastbayscore.org,Welcome to East Bay Score!,,,East Bay SCORE has moved. Our site is now at https://www.score.org/eastbay/!!,
http://ci.richmond.ca.us,Richmond, CA - Official Website | Official WebsiteArrow LeftArrow RightSlideshow Left ArrowSlideshow Right Arrow,,,Common Services, Latest News & Announcements, Calendar of Events,